{
  "version": 1,
  "profiles": [
    "mmds-core-v1",
    "mmdflux-text-v1",
    "mmdflux-text-metrics-v1"
  ],
  "extensions": {
    "org.mmdflux.render.text.v1": {
      "projection": {
        "edge_waypoints": {},
        "label_positions": {},
        "node_ranks": {
          "A": 0,
          "B": 1
        }
      }
    },
    "org.mmdflux.text-metrics.v1": {
      "metricsProfile": {
        "id": "mmdflux-sans-v1",
        "source": "recorded",
        "version": 1
      },
      "defaultTextStyle": {
        "font-family": "\"trebuchet ms\", verdana, arial, sans-serif",
        "font-size": 16.0,
        "font-style": "normal",
        "font-weight": "400",
        "line-height": 24.0
      },
      "layoutText": {
        "node-padding-x": 15.0,
        "node-padding-y": 15.0,
        "label-padding-x": 4.0,
        "label-padding-y": 2.0,
        "edge-label-max-width": 200.0
      }
    }
  },
  "defaults": {
    "node": {
      "shape": "rectangle"
    },
    "edge": {
      "stroke": "solid",
      "arrow_start": "none",
      "arrow_end": "normal",
      "minlen": 1
    }
  },
  "geometry_level": "layout",
  "metadata": {
    "diagram_type": "flowchart",
    "direction": "TD",
    "bounds": {
      "width": 109.7890625,
      "height": 174.0
    },
    "engine": "flux-layered"
  },
  "nodes": [
    {
      "id": "A",
      "label": "Start",
      "position": {
        "x": 54.89453125,
        "y": 35.0
      },
      "size": {
        "width": 93.7890625,
        "height": 54.0
      }
    },
    {
      "id": "B",
      "label": "End",
      "position": {
        "x": 54.89453125,
        "y": 139.0
      },
      "size": {
        "width": 88.46875,
        "height": 54.0
      }
    }
  ],
  "edges": [
    {
      "id": "e0",
      "source": "A",
      "target": "B"
    }
  ]
}
